{
  "updated": "2026-09-27",
  "source": "MULTI_SOURCE",
  "calendarWins": true,
  "events": [
    {
      "vehicleId": "AFL-279006",
      "title": "Captura completa — Chevrolet Colorado AFL-279006",
      "date": "2026-09-28",
      "start": "10:00",
      "end": "11:00",
      "timezone": "America/Mexico_City",
      "status": "CAPTURA_PENDIENTE",
      "type": "CAPTURA_COMERCIAL_COMPLETA",
      "links": {
        "vehicle": "?vehicle=AFL-279006"
      },
      "source": "GOOGLE_CALENDAR"
    },
    {
      "vehicleId": "AFL-338663",
      "title": "Captura de campo — Chevrolet Silverado AFL-338663",
      "date": "2026-09-28",
      "start": "11:30",
      "end": "13:00",
      "timezone": "America/Mexico_City",
      "status": "CAPTURA_PENDIENTE",
      "type": "CAPTURA_COMERCIAL",
      "source": "GOOGLE_CALENDAR"
    },
    {
      "vehicleId": "AFL-279006",
      "title": "Facebook Post — Chevrolet Colorado AFL-279006",
      "date": "2026-09-27",
      "start": "17:22:14",
      "end": null,
      "timezone": "America/Mexico_City",
      "status": "PUBLICADO_CONFIRMADO_POR_MIGUEL",
      "type": "FACEBOOK_POST",
      "source": "META_BUSINESS_SUITE",
      "externalId": "1886741839427469",
      "links": {
        "vehicle": "?vehicle=AFL-279006#channel-post"
      },
      "scheduledDateOriginal": "2026-09-29",
      "scheduledStartOriginal": "19:00",
      "publishedAt": "2026-09-27T17:22:14-06:00",
      "confirmationSource": "MIGUEL",
      "measurement": {
        "cadence": "7D",
        "status": "ACTIVA",
        "startAt": "2026-09-27T17:22:14-06:00",
        "dueAt": "2026-10-04T17:22:14-06:00"
      }
    }
  ],
  "rules": {
    "fieldWorkAuthority": "GOOGLE_CALENDAR",
    "socialPublicationAuthority": "META_BUSINESS_SUITE"
  }
}
